{
  "result": {
    "schemaVersion": "1.0.0",
    "requestId": "req-decision-receipt-golden-vector-1",
    "validatorId": "sha256:47910108d7be9aa20587a85f284b4c6c3aa25f2f936ad86874f3ffbaed51fa5b",
    "policyHash": "sha256:62bb7ca911c6257ec4bea116090b8d0c8607e7d2bbbbf430805f58270c68280a",
    "profileHash": "sha256:bed8e81c5293be85b076cb03e738c339f3f1f5324bda7382d954b6dacbf169bd",
    "manifestHash": "sha256:7f1b7bb2bc8479b3d257ea525d2eff1e927b64c5cd006fb1ba01a3d4b785537f",
    "inputHash": "sha256:c74a8b124bf200331d9021c0531f15b97f99cddf4f6c510f77e2953c2b9d078f",
    "output": {
      "counterOfferCents": 2300000,
      "decision": "COUNTER",
      "humanReviewRequired": false,
      "reasonCodes": [
        "OFFER_BELOW_FLOOR",
        "FINAL_COUNTER_AVAILABLE"
      ],
      "schemaVersion": "1.0.0"
    },
    "outputHash": "sha256:46c563ca501d1743b2cec8c3f244890976ddc25b929cdfb2ebf470ce4ceb5010",
    "executionHash": "sha256:4022569814727cd4c38c4cf3cdf2722eb19fe01a6ebc99e3b7fd0e4f49b493b4",
    "status": "SUCCESS"
  },
  "validatorPublicKey": "cb3065d80f1e2ced6c8c8bdf66cb7809fa384fef4566de4c9b4110919dc23e4b",
  "signatureAlgorithm": "ed25519",
  "signature": "0acb69becd01e67dd92e2397cf8e525c62a0c43121328a6bc75a8f362eaaa2b21550d963032f340802176d33f664201ea636dee886e3449f9d88d2e89cb8fe0b"
}