{
  "result": {
    "schemaVersion": "1.0.0",
    "requestId": "req-decision-receipt-golden-vector-1",
    "validatorId": "sha256:809b417dcd07f1def6cf3f4658f27cf3791261d39bd7239d43fbd4a8a93b5b5c",
    "policyHash": "sha256:62bb7ca911c6257ec4bea116090b8d0c8607e7d2bbbbf430805f58270c68280a",
    "profileHash": "sha256:bed8e81c5293be85b076cb03e738c339f3f1f5324bda7382d954b6dacbf169bd",
    "manifestHash": "sha256:7f1b7bb2bc8479b3d257ea525d2eff1e927b64c5cd006fb1ba01a3d4b785537f",
    "inputHash": "sha256:c74a8b124bf200331d9021c0531f15b97f99cddf4f6c510f77e2953c2b9d078f",
    "output": {
      "counterOfferCents": 2300000,
      "decision": "COUNTER",
      "humanReviewRequired": false,
      "reasonCodes": [
        "OFFER_BELOW_FLOOR",
        "FINAL_COUNTER_AVAILABLE"
      ],
      "schemaVersion": "1.0.0"
    },
    "outputHash": "sha256:46c563ca501d1743b2cec8c3f244890976ddc25b929cdfb2ebf470ce4ceb5010",
    "executionHash": "sha256:4022569814727cd4c38c4cf3cdf2722eb19fe01a6ebc99e3b7fd0e4f49b493b4",
    "status": "SUCCESS"
  },
  "validatorPublicKey": "95e8bb3978993937bb170e0120be891861b8d90c7430c470909a4f63e83d4180",
  "signatureAlgorithm": "ed25519",
  "signature": "8f1331792fc06c77caa40fa3eaa91670a176f29cef741a1006afe590cb7c74c506fc7ddfb21a64f272a90f2972c1150fbdcfb7c12228dd9289ea4d69eeb89e0a"
}